[
  {
    "id": "blk-closed",
    "title": "Closed blocker",
    "status": "closed",
    "priority": 2,
    "issue_type": "task",
    "blockers_count": 0,
    "unblocks_count": 1,
    "children_count": 0,
    "relates_count": 0,
    "is_blocked": false,
    "created_at": "2026-04-10T10:00:00Z",
    "updated_at": "2026-04-11T10:00:00Z"
  },
  {
    "id": "blk-open",
    "title": "Open blocker",
    "status": "open",
    "priority": 1,
    "issue_type": "task",
    "blockers_count": 0,
    "unblocks_count": 1,
    "children_count": 0,
    "relates_count": 0,
    "is_blocked": false,
    "created_at": "2026-04-12T10:00:00Z",
    "updated_at": "2026-04-12T10:00:00Z"
  },
  {
    "id": "target",
    "title": "Target under two blockers",
    "status": "open",
    "priority": 0,
    "issue_type": "feature",
    "blockers_count": 2,
    "unblocks_count": 0,
    "children_count": 0,
    "relates_count": 0,
    "is_blocked": true,
    "created_at": "2026-04-13T10:00:00Z",
    "updated_at": "2026-04-15T10:00:00Z"
  }
]
