[
  {
    "id": "bt-full",
    "title": "Fully populated",
    "status": "in_progress",
    "priority": 0,
    "issue_type": "feature",
    "labels": [
      "area:cli",
      "area:docs"
    ],
    "assignee": "sms",
    "source_repo": "bt",
    "blockers_count": 0,
    "unblocks_count": 0,
    "children_count": 0,
    "relates_count": 0,
    "is_blocked": false,
    "created_at": "2026-04-15T10:00:00Z",
    "updated_at": "2026-04-20T12:00:00Z",
    "due_date": "2026-05-01T00:00:00Z",
    "created_by_session": "sess-create",
    "claimed_by_session": "sess-claim",
    "closed_by_session": "sess-close"
  }
]
