[
  {
    "id": "bt-1",
    "title": "bt: build the thing",
    "status": "open",
    "priority": 0,
    "issue_type": "feature",
    "labels": [
      "area:cli"
    ],
    "source_repo": "bt",
    "blockers_count": 1,
    "unblocks_count": 0,
    "children_count": 0,
    "relates_count": 0,
    "is_blocked": true,
    "created_at": "2026-04-10T10:00:00Z",
    "updated_at": "2026-04-20T10:00:00Z"
  },
  {
    "id": "bt-2",
    "title": "bt: polish the thing",
    "status": "open",
    "priority": 2,
    "issue_type": "task",
    "source_repo": "bt",
    "blockers_count": 0,
    "unblocks_count": 0,
    "children_count": 0,
    "relates_count": 1,
    "is_blocked": false,
    "created_at": "2026-04-11T10:00:00Z",
    "updated_at": "2026-04-11T10:00:00Z"
  },
  {
    "id": "bd-1",
    "title": "bd: upstream change",
    "status": "open",
    "priority": 1,
    "issue_type": "feature",
    "source_repo": "beads",
    "blockers_count": 0,
    "unblocks_count": 1,
    "children_count": 0,
    "relates_count": 0,
    "is_blocked": false,
    "created_at": "2026-04-05T10:00:00Z",
    "updated_at": "2026-04-20T10:00:00Z"
  },
  {
    "id": "bd-2",
    "title": "bd: unrelated",
    "status": "closed",
    "priority": 3,
    "issue_type": "task",
    "source_repo": "beads",
    "blockers_count": 0,
    "unblocks_count": 0,
    "children_count": 0,
    "relates_count": 0,
    "is_blocked": false,
    "created_at": "2026-04-01T10:00:00Z",
    "updated_at": "2026-04-02T10:00:00Z",
    "closed_at": "2026-04-02T10:00:00Z"
  }
]
