[
  {
    "id": "bt-min",
    "title": "Minimal issue",
    "status": "open",
    "priority": 2,
    "issue_type": "task",
    "blockers_count": 0,
    "unblocks_count": 0,
    "children_count": 0,
    "relates_count": 0,
    "is_blocked": false,
    "created_at": "2026-04-15T10:00:00Z",
    "updated_at": "2026-04-15T10:00:00Z"
  }
]
